{
  "version": 1,
  "meta": {
    "projectName": "logodev-mcp",
    "dockerImage": "ghcr.io/pvliesdonk/logodev-mcp:latest",
    "envPrefix": "LOGODEV_MCP"
  },
  "secretKeys": [
    "LOGODEV_MCP_BEARER_TOKEN",
    "LOGODEV_MCP_OIDC_CLIENT_SECRET",
    "LOGODEV_MCP_OIDC_JWT_SIGNING_KEY"
  ],
  "questions": [
    {
      "id": "deployment",
      "label": "Where will the server run?",
      "help": "Local stdio for Claude Desktop/Code, or an HTTP server for Docker/systemd.",
      "type": "select",
      "options": [
        {
          "value": "local",
          "label": "Local (Claude Desktop / Claude Code, stdio)",
          "emit": {
            "LOGODEV_MCP_TRANSPORT": "stdio"
          }
        },
        {
          "value": "server",
          "label": "Server (HTTP — Docker / Compose / systemd)",
          "emit": {
            "LOGODEV_MCP_TRANSPORT": "http"
          }
        }
      ]
    },
    {
      "id": "auth",
      "label": "Authentication",
      "type": "select",
      "showIf": {
        "deployment": [
          "server"
        ]
      },
      "options": [
        {
          "value": "none",
          "label": "None"
        },
        {
          "value": "bearer",
          "label": "Bearer token"
        },
        {
          "value": "oidc",
          "label": "OIDC"
        },
        {
          "value": "both",
          "label": "Bearer + OIDC"
        }
      ]
    },
    {
      "id": "host",
      "label": "Bind host",
      "type": "text",
      "var": "LOGODEV_MCP_HOST",
      "help": "Interface the HTTP server binds to.",
      "advancedGroup": "Server",
      "showIf": {
        "deployment": [
          "server"
        ]
      }
    },
    {
      "id": "port",
      "label": "Port",
      "type": "number",
      "var": "LOGODEV_MCP_PORT",
      "help": "TCP port for the HTTP server.",
      "advancedGroup": "Server",
      "showIf": {
        "deployment": [
          "server"
        ]
      }
    },
    {
      "id": "base_url",
      "label": "Public base URL",
      "type": "text",
      "var": "LOGODEV_MCP_BASE_URL",
      "help": "Public base URL of the deployed server, e.g. `https://mcp.example.com`. Required for OIDC. Also the fallback source of the MCP Apps domain when `app_domain` is unset.",
      "showIf": {
        "deployment": [
          "server"
        ]
      }
    },
    {
      "id": "bearer_token",
      "label": "Bearer token",
      "type": "text",
      "var": "LOGODEV_MCP_BEARER_TOKEN",
      "help": "Single shared bearer token; enables bearer auth unless `bearer_tokens_file` is set, which takes precedence.",
      "showIf": {
        "deployment": [
          "server"
        ],
        "auth": [
          "bearer",
          "both"
        ]
      }
    },
    {
      "id": "oidc_config_url",
      "label": "OIDC discovery URL",
      "type": "text",
      "var": "LOGODEV_MCP_OIDC_CONFIG_URL",
      "help": "OIDC discovery document URL, e.g. `https://auth.example.com/.well-known/openid-configuration`.",
      "showIf": {
        "deployment": [
          "server"
        ],
        "auth": [
          "oidc",
          "both"
        ]
      }
    },
    {
      "id": "oidc_client_id",
      "label": "OIDC client ID",
      "type": "text",
      "var": "LOGODEV_MCP_OIDC_CLIENT_ID",
      "help": "OIDC client identifier registered with the provider.",
      "showIf": {
        "deployment": [
          "server"
        ],
        "auth": [
          "oidc",
          "both"
        ]
      }
    },
    {
      "id": "oidc_client_secret",
      "label": "OIDC client secret",
      "type": "text",
      "var": "LOGODEV_MCP_OIDC_CLIENT_SECRET",
      "help": "OIDC client secret registered with the provider.",
      "showIf": {
        "deployment": [
          "server"
        ],
        "auth": [
          "oidc",
          "both"
        ]
      }
    },
    {
      "id": "oidc_audience",
      "label": "OIDC audience",
      "type": "text",
      "var": "LOGODEV_MCP_OIDC_AUDIENCE",
      "help": "Expected `aud` claim; tokens issued for another audience are rejected.",
      "advancedGroup": "Auth",
      "showIf": {
        "deployment": [
          "server"
        ],
        "auth": [
          "oidc",
          "both"
        ]
      }
    },
    {
      "id": "oidc_required_scopes",
      "label": "OIDC required scopes (CSV)",
      "type": "text",
      "var": "LOGODEV_MCP_OIDC_REQUIRED_SCOPES",
      "help": "Scopes a caller must present, space- or comma-separated. Defaults to `openid` in oidc-proxy mode.",
      "advancedGroup": "Auth",
      "showIf": {
        "deployment": [
          "server"
        ],
        "auth": [
          "oidc",
          "both"
        ]
      }
    },
    {
      "id": "oidc_jwt_signing_key",
      "label": "OIDC JWT signing key",
      "type": "text",
      "var": "LOGODEV_MCP_OIDC_JWT_SIGNING_KEY",
      "help": "Optional signing key for issued JWTs. When unset it is derived from the client secret; set explicitly to keep tokens valid across a secret rotation. Generate: openssl rand -hex 32.",
      "showIf": {
        "deployment": [
          "server"
        ],
        "auth": [
          "oidc",
          "both"
        ]
      }
    },
    {
      "id": "oidc_verify_access_token",
      "label": "Verify access token (not id token)",
      "type": "bool",
      "var": "LOGODEV_MCP_OIDC_VERIFY_ACCESS_TOKEN",
      "help": "Validate the access token instead of the id token.",
      "advancedGroup": "Auth",
      "showIf": {
        "deployment": [
          "server"
        ],
        "auth": [
          "oidc",
          "both"
        ]
      }
    },
    {
      "id": "kv_store_url",
      "label": "KV store URL (HTTP session persistence)",
      "type": "text",
      "var": "LOGODEV_MCP_KV_STORE_URL",
      "help": "Persistent-state backend URL: memory://, file:///path, redis://, dynamodb://, or mongodb://. Defaults to file:///data/state when unset.",
      "advancedGroup": "Persistence",
      "showIf": {
        "deployment": [
          "server"
        ]
      }
    },
    {
      "id": "event_store_url",
      "label": "Event store URL (HTTP resumability)",
      "type": "text",
      "var": "LOGODEV_MCP_EVENT_STORE_URL",
      "help": "Legacy state-backend override, honoured by `build_event_store` and `build_kv_store` only when `kv_store_url` is unset — it then backs every namespace, not just HTTP resumability. Prefer `kv_store_url` for new deployments.",
      "advancedGroup": "Persistence",
      "showIf": {
        "deployment": [
          "server"
        ]
      }
    },
    {
      "id": "tasks_url",
      "label": "Tasks Url",
      "type": "text",
      "var": "LOGODEV_MCP_TASKS_URL",
      "help": "Background-task (Docket) backend URL: `memory://` is in-process and lost on restart; `redis://` is durable and multi-process. When unset, a `redis://` `kv_store_url` is reused for tasks too; otherwise fastmcp's `memory://` default applies. Only meaningful when task-enabled tools exist. Applied via `configure_task_backend`.",
      "advancedGroup": "Persistence",
      "showIf": {
        "deployment": [
          "server"
        ]
      }
    },
    {
      "id": "app_domain",
      "label": "MCP Apps domain",
      "type": "text",
      "var": "LOGODEV_MCP_APP_DOMAIN",
      "help": "MCP Apps iframe domain, used for CSP sandboxing. Overrides the host derived from `base_url`.",
      "advancedGroup": "MCP Apps",
      "showIf": {
        "deployment": [
          "server"
        ]
      }
    },
    {
      "id": "tools_allow",
      "label": "Tool allowlist (CSV)",
      "type": "text",
      "var": "LOGODEV_MCP_TOOLS_ALLOW",
      "help": "Comma-separated tool names this instance exposes; every other tool is hidden. Leave empty to expose all tools. Mutually exclusive with the denylist.",
      "advancedGroup": "Tools"
    },
    {
      "id": "tools_deny",
      "label": "Tool denylist (CSV)",
      "type": "text",
      "var": "LOGODEV_MCP_TOOLS_DENY",
      "help": "Comma-separated tool names to hide from this instance. Mutually exclusive with the allowlist.",
      "advancedGroup": "Tools"
    },
    {
      "id": "bearer_tokens_file",
      "label": "Bearer tokens file (TOML)",
      "type": "text",
      "var": "LOGODEV_MCP_BEARER_TOKENS_FILE",
      "help": "Path to a TOML file mapping bearer tokens to subjects; overrides the single-token `bearer_token` mode.",
      "advancedGroup": "Auth",
      "showIf": {
        "deployment": [
          "server"
        ],
        "auth": [
          "bearer",
          "both"
        ]
      }
    },
    {
      "id": "bearer_default_subject",
      "label": "Bearer default subject",
      "type": "text",
      "var": "LOGODEV_MCP_BEARER_DEFAULT_SUBJECT",
      "help": "Subject assigned to the single-token bearer mode; ignored when `bearer_tokens_file` is set, since mapped mode carries per-token subjects.",
      "advancedGroup": "Auth",
      "showIf": {
        "deployment": [
          "server"
        ],
        "auth": [
          "bearer",
          "both"
        ]
      }
    },
    {
      "id": "server_name",
      "label": "Server Name",
      "type": "text",
      "var": "LOGODEV_MCP_SERVER_NAME",
      "help": "Rename this server instance; defaults to the project name.",
      "advancedGroup": "Server",
      "showIf": {
        "deployment": [
          "server"
        ]
      }
    },
    {
      "id": "instructions",
      "label": "Instructions",
      "type": "text",
      "var": "LOGODEV_MCP_INSTRUCTIONS",
      "help": "Replaces the default MCP instructions text sent to clients.",
      "advancedGroup": "Server",
      "showIf": {
        "deployment": [
          "server"
        ]
      }
    },
    {
      "id": "http_path",
      "label": "HTTP endpoint path",
      "type": "text",
      "var": "LOGODEV_MCP_HTTP_PATH",
      "help": "Mount path for the MCP endpoint.",
      "advancedGroup": "Server",